{
  "messageId": "results-applied-senior-message",
  "messageType": "matigr.results.result-evaluation-applied",
  "schemaVersion": 1,
  "producer": "Results",
  "occurredAt": "2026-10-23T05:20:00Z",
  "aggregateType": "EvaluationReceipt",
  "aggregateId": "check-appeal-1",
  "aggregateVersion": "1",
  "correlationId": "appeal-senior-1",
  "causationId": "check-completed-message-appeal-senior-1",
  "payload": {
    "evaluationId": "check-appeal-1",
    "kind": "Appeal",
    "reviewerId": "6adf74af-fc84-5afb-8708-0db40939d2ff",
    "assignmentId": "assignment-senior",
    "evaluationDecisionOrigin": "SeniorEscalation",
    "solutionId": "19537a57-dbab-56eb-a167-e04a7b3104fe",
    "materialVersionId": "3be2c5aa-ff91-5af7-8649-edfeebebd0fc",
    "tournamentId": "0344e06b-4ea1-582e-bd91-e832719773f2",
    "teamId": "ce3eb69e-e2b8-5f58-a45c-40c9d71d0031",
    "taskId": "acdc6594-8ac1-5f18-bb65-def577a79950",
    "resultId": "result-1",
    "expectedResultVersion": "1",
    "resultVersion": "2",
    "previousOutcome": "Incorrect",
    "outcome": "Correct",
    "previousScore": "0",
    "score": "20",
    "scoreRuleVersion": "fixture-v1",
    "changed": true,
    "appliedAt": "2026-10-23T05:19:59Z",
    "publicationState": "Published",
    "basePublicationId": "publication-base-1",
    "publicationId": "publication-corrected-2",
    "appealId": "appeal-1",
    "recheckRequestId": "request-1",
    "baseCheckId": "check-initial-1",
    "selectedReviewerId": "6b8e3a04-ab14-5bdd-92cc-4a767e67f29b",
    "escalationId": "escalation-1"
  }
}
