{
  "messageId": "results-applied-noop-message",
  "messageType": "matigr.results.result-evaluation-applied",
  "schemaVersion": 1,
  "producer": "Results",
  "occurredAt": "2026-10-23T04:20:00Z",
  "aggregateType": "EvaluationReceipt",
  "aggregateId": "check-appeal-1",
  "aggregateVersion": "1",
  "correlationId": "appeal-1",
  "causationId": "check-completed-message-appeal-1",
  "payload": {
    "evaluationId": "check-appeal-1",
    "kind": "Appeal",
    "reviewerId": "jury-a",
    "assignmentId": "assignment-appeal-1",
    "evaluationDecisionOrigin": "AppealReview",
    "solutionId": "solution-team-a-task-1",
    "materialVersionId": "material-v1",
    "tournamentId": "tournament-1",
    "teamId": "team-a",
    "taskId": "task-1",
    "resultId": "result-team-a-task-1",
    "expectedResultVersion": "1",
    "resultVersion": "1",
    "previousOutcome": "Correct",
    "outcome": "Correct",
    "previousScore": "10",
    "score": "10",
    "scoreRuleVersion": "fixture-v1",
    "changed": false,
    "appliedAt": "2026-10-23T04:19:59Z",
    "publicationState": "Published",
    "basePublicationId": "publication-original-1",
    "publicationId": "publication-original-1",
    "appealId": "appeal-1",
    "recheckRequestId": "recheck-request-1",
    "baseCheckId": "check-initial-1",
    "selectedReviewerId": "jury-a"
  }
}
